{"entries":[{"qualification":{"digest_sha256":"95fd4ec4f55e75442538f96a9b97fbe5bf77fbb2b38f39c13bae6229ccb0f97f","path":"contracts/tasks/omp-native.responsive-incident-console/1.0.0/qualification.json"},"task":{"digest_sha256":"f0f2cc33f7ca5a39f35d8437446804ff3a66e1bbccd839e51556bf4ad073d367","path":"contracts/tasks/omp-native.responsive-incident-console/1.0.0/task.json"}}],"pack_id":"designer-v1","partition":"anchor","required_capabilities":["ui-implementation","visual-design-judgment","interaction-design","responsive-layout","accessibility-reasoning"],"role":"designer","role_contract":{"contract_id":"role-contract/designer/v1","digest_sha256":"d2af35132faead9ec29cd01aa8fb671b309cc92b6894de1c29f84a8b46205bbc"},"routing_eligible":false,"schema_version":"omp.task-pack/v1","selection_method":"fixed-anchor","status":"calibration","task_mix":"designer-v1"}
