{"entries":[{"qualification":{"digest_sha256":"ec278d705fdaeab289e18ddeeb0e3016ace782ed74ce73173bd89cfe17c3f614","path":"contracts/tasks/terminal-bench.fix-code-vulnerability/2.1-r6/qualification.json"},"task":{"digest_sha256":"b9f5ba289e0fed622fe20a006560470a0876e58fea551254e4d327fb6fd5aff3","path":"contracts/tasks/terminal-bench.fix-code-vulnerability/2.1-r6/task.json"}},{"qualification":{"digest_sha256":"3cecc3321b1934d6dd611dcd799902b479ceca9645b6bb6a8fd1a54cc8032e95","path":"contracts/tasks/terminal-bench.memcached-backdoor/3.0-r1/qualification.json"},"task":{"digest_sha256":"5cb87ba106020d4959273db46ae3b9a88e399b8967e0d78deaec560cf4302099","path":"contracts/tasks/terminal-bench.memcached-backdoor/3.0-r1/task.json"}}],"pack_id":"advisor-v1","partition":"anchor","required_capabilities":["code-review","defect-detection","risk-analysis","evidence-citation","false-positive-control"],"role":"advisor","role_contract":{"contract_id":"role-contract/advisor/v1","digest_sha256":"8bc6e30d3a060a23124b9e8b0825f1f2d387d6d229a00af69b74fa0ffc2c66d8"},"routing_eligible":false,"schema_version":"omp.task-pack/v1","selection_method":"fixed-anchor","status":"calibration","task_mix":"advisor-v1"}
