{"entries":[{"qualification":{"digest_sha256":"36969ef8a1f8d9d87f9854c44d6a6bba84c5d24ebe9831adfe8170a7fe4f8fb5","path":"contracts/tasks/omp-native.metadata-normalization/1.0.0/qualification.json"},"task":{"digest_sha256":"dd9bb919d255a9cfe6ca22fe12cd6c599f9603a0b0f5300606c6c26f312a1028","path":"contracts/tasks/omp-native.metadata-normalization/1.0.0/task.json"}}],"pack_id":"tiny-v1","partition":"anchor","required_capabilities":["structured-output","exact-format-following","metadata-transformation","classification","minimal-output"],"role":"tiny","role_contract":{"contract_id":"role-contract/tiny/v1","digest_sha256":"1dc4d1f96cb93e7bab22f3334e1310dd3ab8acfeba98466a2c1523b3d6426941"},"routing_eligible":false,"schema_version":"omp.task-pack/v1","selection_method":"fixed-anchor","status":"calibration","task_mix":"tiny-v1"}
