{"entries":[{"qualification":{"digest_sha256":"d9fd630d688fbbfafe035f0572ff44efc7200a2bd0d4d5cbafbc0f756866113c","path":"contracts/tasks/terminal-bench.custom-memory-heap-crash/2.1-r6/qualification.json"},"task":{"digest_sha256":"13925d568959e746a63937a3df18baeb5b732d74964cb151d995aad3953e4c84","path":"contracts/tasks/terminal-bench.custom-memory-heap-crash/2.1-r6/task.json"}},{"qualification":{"digest_sha256":"377fc3caef6f37a9f747884f24550668d50e864b18c6b7e146d18242a0c27f99","path":"contracts/tasks/terminal-bench.db-wal-recovery/2.1-r6/qualification.json"},"task":{"digest_sha256":"68bc0197bb37b759dd9fa40798962c42c473693bdabb99b2e20e91db9d8e3d41","path":"contracts/tasks/terminal-bench.db-wal-recovery/2.1-r6/task.json"}}],"pack_id":"slow-v1","partition":"anchor","required_capabilities":["root-cause-analysis","long-horizon-reasoning","hypothesis-testing","debugging-tool-use","failure-recovery"],"role":"slow","role_contract":{"contract_id":"role-contract/slow/v1","digest_sha256":"9cad9586cbba11d2a0d07507995cbd098faeab621bcf65516f589b17a722c822"},"routing_eligible":false,"schema_version":"omp.task-pack/v1","selection_method":"fixed-anchor","status":"calibration","task_mix":"slow-v1"}
